run_id,kp,kl_target,chunk_size,tokens,answer,reasoning
baseline,,,,1378,13,"Seven bottles of soda cost $21.00 while 4 bottles of water cost $8. If David wants to buy 3 bottles of soda and 2 bottles of water, how much will that cost?

Answer step by step and end with: Final answer: \boxed{numeric_value}.

Alright, so I've got this problem here about buying soda and water from the store. Let me try to figure it out step by step because sometimes these word problems can be a bit confusing at first glance.

First off, let's parse what we know:

- Seven bottles of soda cost $21.00.
- Four bottles of water cost $8.00.
- David wants to buy three bottles of soda and two bottles of water.
  
We need to find out how much that total will cost him.

Okay, so maybe breaking down each part would help? Like, figuring out the individual prices per bottle for both soda and water, then calculating the total based on his desired quantities.

Starting with the soda. It says seven bottles cost $21. So if one is priced equally, perhaps dividing 21 by 7 gives us the price per bottle.

Let me write that down as an equation:
Price per soda = Total cost / Number of bottles
So,
Price per soda = $21.00 ÷ 7

Hmm, doing that division... Well, 7 goes into 21 exactly 3 times. So, $21 divided by 7 equals $3. That means each bottle of soda costs $3. Cool, easy enough.

Now onto the water. The problem states four bottles cost $8.00. Similar approach should work here too—divide the total amount by the number of bottles to get the unit price.

Using another formula:
Price per water = Total cost / Number of bottles
Therefore,
Price per water = $8.00 ÷ 4

Calculating that... 4 goes into 8 twice. So, $8 divided by 4 is $2. Each bottle of water costs $2. Got it.

Alright, now that we have the individual prices, let's move on to what David needs to purchase.

He wants to buy three bottles of soda and two bottles of water. To find the total cost, we'll calculate the cost separately for each item and then add them together.

Starting with the sodas:
Number of soda bottles he wants × Price per soda
Which translates to:
Cost for sodas = 3 × ($3)

Multiplying those numbers... 3 multiplied by 3 is 9. So, the sodas alone will cost $9.00.

Next up are the waters:
Similarly, multiply the number of water bottles by their respective price.
Cost for waters = 2 × ($2)

That comes out to 2 times 2, which is 4. Therefore, the waters will cost $4.00 in total.

To find the overall total cost, we just add the cost for sodas and the cost for waters together.
Total cost = Cost for sodas + Cost for waters
Plugging in our values...
Total cost = $9.00 + $4.00

Adding those amounts... $9 plus $4 is $13.00. 

Wait a second, hold on—is there any chance I made a mistake somewhere? Let me double-check my calculations.

For the soda again: 7 bottles for $21. Divided by 7 is indeed $3 per bottle—that seems right.

Water: 4 bottles for $8. Dividing 8 by 4 does give $2 per bottle—it checks out too.

Then, multiplying the quantity he wants (three and two) respectively by their prices. For sodas, 3 x 3 is definitely 9; no issues there. Water: 2 x 2 is 4. Adding 9 and 4 gets you 13. Hmm, everything adds up correctly.

Is there anything else I might have missed? Maybe units or something? But since all the given information was in dollars and whole numbers, nothing seems tricky here.

Alternatively, could I think of scaling things differently? Like, instead of finding the unit price, maybe set up equations proportionally?

But wait, actually, when dealing with proportional relationships like this, setting up proportions isn't necessary unless needed specifically. Since we're only asked about specific quantities, straightforward multiplication suffices.

Just thinking through whether the question expects some kind of combined rate or something more complex—but reading back, it doesn’t seem like that’s required. It clearly asks for separate purchases of different items, so simple addition after computing individual costs makes sense.

Another way someone might trip over this is misapplying the initial totals—if they thought ""seven bottles"" meant something else but according to standard terminology, yes, seven bottles costing $21 implies each is $3 regardless of context.

Same logic applies to water: four bottles for eight dollars, meaning each is half a dollar, not considering other factors.

I don't see any hidden fees or discounts mentioned in the problem statement either, so we’re safe assuming the prices remain constant irrespective of the quantity purchased beyond the ones specified.

Thus, consolidating all steps once more:

Soda:
- Quantity: 3 bottles
- Unit price: $3/bottle
- Total cost: 3 * 3 = $9

Water:
- Quantity: 2 bottles
- Unit price: $2/bottle
- Total cost: 2 * 2 = $4

Combined total:
$9 + $4 = $13

Yep, sounds solid. No mistakes detected upon review.

**Final Answer**
The total cost for David's purchase will be \boxed{13}.
</think>

David wants to buy 3 bottles of soda and 2 bottles of water. We start by determining the individual prices per bottle for each drink.

First, we find the price per bottle of soda:
\[
\text{Price per soda} = \frac{\$21.00}{7} = \$3.00
\]

Next, we find the price per bottle of water:
\[
\text{Price per water} = \frac{\$8.00}{4} = \$2.00
\]

Now, we calculate the total cost for 3 bottles of soda:
\[
\text{Cost for sodas} = 3 \times \$3.00 = \$9.00
\]

And the total cost for 2 bottles of water:
\[
\text{Cost for waters} = 2 \times \$2.00 = \$4.00
\]

Finally, we add the costs together to find the total amount David will spend:
\[
\text{Total cost} = \$9.00 + \$4.00 = \$13.00
\]

\[
\boxed{13}
\]"
raspid_01,0.12,0.15,32.0,2048,numeric_value,"Seven bottles of soda cost $21.00 while 4 bottles of water cost $8. If David wants to buy 3 bottles of soda and 2 bottles of water, how much will that cost?

Answer step by step and end with: Final answer: \boxed{numeric_value} & & & & & \end{matrix} \right. \right.

Wait, maybe I need to write it in a different way. Let me try to think of another approach.

Suppose I set all the variables to 1. Then the left-hand side becomes (1 + 1)^n = 2^n, and the right-hand side becomes 1 + 1 + ... + 1, with n+1 terms. So 2^n = n+1. Let me check for which n this holds.

For n=1: 2^1 = 2, and 1+1=2. So it holds.

For n=2: 2^2=4, and 2+1=3. Doesn't hold.

For n=3: 8 vs 4. Doesn't hold.

So n=1 is a solution. Let me check n=0: 2^0=1, and 0+1=1. So n=0 also holds.

So n=0 and n=1 are solutions. Let me see if there are more.

Suppose I set some variables to 0 and others to 1. Let's see.

Suppose I have k variables set to 1 and the rest set to 0. Then the left-hand side becomes (1 + 0 + ... + 0)^n = 1^n = 1. The right-hand side becomes k*1 + (n+1 - k)*0 = k. So 1 = k. So k=1.

So the only solutions are when exactly one variable is 1 and the rest are 0. But wait, in the original problem, the left-hand side is (x1 + x2 + ... + xn)^n. So when I set all variables to 1 except one, which is 0, then the left-hand side becomes (n)^n. The right-hand side is the sum of all variables, which is n. So n^n = n. So n=0 and n=1.

Wait, but earlier when I thought about setting all variables to 1, I found that n=1 works. So maybe n=0 and n=1 are the only solutions.

Let me check for n=2. If n=2, then the equation is (x1 + x2)^2 = x1 + x2 + x3 + x4. Wait, no, n=2, so the left-hand side is (x1 + x2)^2, and the right-hand side is x1 + x2 + x3 + x4? Wait, no, when n=2, the right-hand side should have n+1 terms, each variable appearing once. So it's x1 + x2 + x3 + x4? Wait, no, n=2, so right-hand side is x1 + x2, but n+1=3? Wait, I'm getting confused.

Wait, in the original problem, the right-hand side is the sum of all variables. So when n=2, the right-hand side should have n+1=3 variables? No, that can't be, because the left-hand side is (x1 + x2)^2. So the right-hand side should have n+1=3 terms, each variable appearing once. So it's x1 + x2 + x3. So when n=2, the equation is (x1 + x2)^2 = x1 + x2 + x3. Let me see if this holds for some variables.

If I set x1=x2=x3=1, then left-hand side is 2^2=4, right-hand side is 1+1+1=3. So 4≠3. Doesn't work.

If I set x1=x2=1, x3=0, then left-hand side is 2^2=4, right-hand side is 1+1+0=2. 4≠2.

If I set x1=1, x2=0, x3=1, left-hand side is (1+0)^2=1, right-hand side is 1+0+1=2. 1≠2.

If I set x1=1, x2=1, x3=0, left-hand side is (2)^2=4, right-hand side is 1+1+0=2. 4≠2.

Wait, maybe n=2 doesn't have a solution. So n=0 and n=1 are the only solutions.

Wait, but earlier when I set all variables to 1, for n=1, it worked, and for n=0, it also worked.

So perhaps the only solutions are n=0 and n=1.

Let me check n=3. So equation is (x1 + x2 + x3)^3 = x1 + x2 + x3 + x4 + x5 + x6 + x7 + x8 + x9.

Wait, no, when n=3, the right-hand side should have n+1=4 variables? No, that's not right. Wait, for n=3, the right-hand side should have n+1=4 variables, each appearing once. So it's x1 + x2 + x3 + x4.

So equation is (x1 + x2 + x3)^3 = x1 + x2 + x3 + x4. Let me try to see if this holds for some variables.

Suppose all variables are 1. Then left-hand side is (3)^3=27, right-hand side is 4. 27≠4.

If I set x1=x2=x3=1, x4=0. Left-hand side: (3)^3=27. Right-hand side:1+1+1+0=3. 27≠3.

If I set x1=1, x2=1, x3=1, x4=1. Then left-hand side is (4)^3=64, right-hand side is 4. 64≠4.

Wait, maybe n=3 doesn't work. So the only solutions are n=0 and n=1.

Wait, but earlier when I thought of setting all variables to 1, for n=1, it worked, and for n=0, it worked. So perhaps these are the only solutions.

Wait, but let me think again. When n=1, the equation is x1 = x1 + x2 + x3 + ... + xn+1. Wait, no, when n=1, the right-hand side is x1 + x2 + x3 + ... + x2, which is two variables? No, that's not correct.

Wait, perhaps I made a mistake in understanding the problem. Let me go back.

The problem says: (x1 + x2 + ... + xn)^n = x1 + x2 + ... + xn + xn+1 + ... + x_{n+1}.

Wait, so the right-hand side is the sum of all variables from x1 to x_{n+1}. So when n=1, right-hand side is x1 + x2. Left-hand side is (x1 + x2)^1 = x1 + x2. So equation holds for any x1, x2.

Wait, but in the problem, are x1, x2, ..., xn, xn+1 binary variables (0 or 1) or real numbers?

Wait, the problem statement is a bit ambiguous, but perhaps I should assume that they are binary variables, i.e., each x_i is either 0 or 1.

If that's the case, then let me try to solve the problem again.

Suppose each x_i is 0 or 1. Then the left-hand side is (sum_{i=1}^n x_i)^n. The right-hand side is sum_{i=1}^{n+1} x_i.

So the equation is (sum_{i=1}^n x_i)^n = sum_{i=1}^{n+1} x_i.

Let me denote S = sum_{i=1}^n x_i. Then the equation becomes S^n = sum_{i=1}^{n+1} x_i.

But sum_{i=1}^{n+1} x_i = S + x_{n+1}.

So equation is S^n = S + x_{n+1}.

Since x_{n+1} is either 0 or 1, S^n can be either S or S+1.

So S^n = S + x_{n+1}.

So two cases:

Case 1: x_{n+1}=0. Then S^n = S.

Case 2: x_{n+1}=1. Then S^n = S + 1.

Let me consider Case 1: S^n = S.

Since S is the sum of n binary variables, S can be 0, 1, 2, ..., n.

So S^n = S.

Let me see for which S this holds:

For S=0: 0^n = 0. True for any n.

For S=1: 1^n = 1. True for any n.

For S>1: S^n grows much faster than S, so S^n > S for S >=2, n >=1.

So for S=0 and S=1, the equation holds.

Similarly, for Case 2: S^n = S + 1.

So S^n - S - 1 = 0.

We need to find S where this holds.

S can be 0,1,2,...,"
raspid_02,0.12,0.15,48.0,2048,numeric_value,"Seven bottles of soda cost $21.00 while 4 bottles of water cost $8. If David wants to buy 3 bottles of soda and 2 bottles of water, how much will that cost?

Answer step by step and end with: Final answer: \boxed{numeric_value} & \text{m} \\ \hline
\text{M} & \text{M} & \text{M} & \text{M} & \text{M} & \text{M} & \text{M} & \text{M} & \text{M} & \text{M} \\
\hline
\text{B} & \text{B} & \text{B} & \text{B} & \text{B} & \text{B} & \text{B} & \text{B} & \text{B} & \text{B} & \text{B}
\end{array}
\]

Each cell represents a number, and the arrangement follows the given pattern. If the sum of all the numbers in the grid is 100, what is the value of the number in the center cell?

**Note: Assume that all numbers are integers.**

First, I need to figure out how many times each letter appears in the grid. Then, since each occurrence of a letter represents a number, I can express the total sum as a combination of these letters.

Wait, but each cell is a letter, and each cell is a number. So, if a cell is 'A', it's a number, say x. Then, the total sum is the sum of all x's for each cell.

So, for example, if there are 10 cells, each labeled 'A', then the total sum would be 10*x, where x is the value of each 'A' cell.

But in this case, each cell is labeled with a letter, but each cell's value is an integer. So, each cell's value is equal to the letter it's labeled with.

Wait, that might not be the case. Let me think again.

Looking at the grid, each cell is labeled with a letter, but the value of each cell is equal to the letter it's labeled with. So, if a cell is labeled 'A', its value is 'A' as an integer. Similarly, if a cell is labeled 'B', its value is 'B' as an integer. So, each cell's value is equal to the label it's labeled with.

Therefore, the sum of all the numbers in the grid is equal to the sum of all the letters in the grid.

So, for example, the total sum is equal to the sum of each cell's value, which is equal to the sum of the letters in the grid.

Given that the sum of all numbers in the grid is 100, we can say that the sum of all the letters in the grid is also 100.

So, in the grid, each cell is labeled with a letter, and the value of each cell is equal to the letter's value.

Therefore, the total sum is the sum of all letters in the grid.

So, in order to solve the problem, we can think of the grid as having letters, and the sum of those letters is 100. We need to find the value of the center cell.

So, first, let's figure out how many letters are in the grid. The grid is 10x10, so there are 100 cells. Each cell is labeled with a letter.

Looking at the grid, the letters are arranged in a pattern. The first row is A, B, C, D, E, F, G, H, I, J. The second row is J, I, H, G, F, E, D, C, B, A. The third row is A, B, C, D, E, F, G, H, I, J. And so on, alternating between A to J and J to A in each row.

So, each row alternates between A to J and J to A. So, the first row is A to J, the second row is J to A, the third row is A to J, etc.

Therefore, each pair of rows (one starting with A to J, the next starting with J to A) has the same letters in reverse order.

So, in the grid, each letter from A to J appears twice, once in each row, but in reverse order.

So, the letters A to J each appear twice, but in different rows.

So, the total number of times each letter appears in the grid is two times, except for the center cell.

Wait, the grid is 10x10, so each letter appears twice, except for the center cell, which appears once.

Wait, let me think. Each letter appears twice in the grid, except for the center cell.

Wait, no. Let's think about it.

Each letter appears twice in each row. Since there are 10 rows, each letter appears 2*10=20 times.

Wait, but in the grid, each cell is labeled with a letter, so each cell is a single letter. So, each letter appears once per row, but since the grid has 10 rows, each letter appears 10 times.

Wait, hold on, maybe I'm confusing the grid with the letters.

Let me clarify.

Each cell in the grid is labeled with a letter. The grid is 10x10, so there are 100 cells. Each cell is labeled with a letter.

The arrangement of letters is such that the first row is A to J, the second row is J to A, the third row is A to J, etc.

So, each letter from A to J appears twice in the grid, once in each row, but in reverse order.

So, letter A appears in the first row and the third row, etc., but in reverse order.

Wait, no. Let's think of it as a 10x10 grid.

Each letter appears in two rows: one starting with A to J, the other starting with J to A. Each row has 10 cells, each labeled with a letter from A to J.

So, each letter appears in two rows, each row has 10 cells, so each letter appears 2*10=20 times in the grid.

Wait, but that can't be, because there are only 100 letters in the grid.

Wait, no, each cell is labeled with a letter, so 100 letters in total.

Each letter appears in two rows, each row has 10 letters, so each letter appears 20 times in the grid.

But 100 letters, each appearing 20 times, would be 2000 letters, which is way more than 100.

So, that can't be.

Wait, perhaps I'm misunderstanding the grid.

Looking back at the grid:

First row: A, B, C, D, E, F, G, H, I, J

Second row: J, I, H, G, F, E, D, C, B, A

Third row: A, B, C, D, E, F, G, H, I, J

Fourth row: J, I, H, G, F, E, D, C, B, A

And so on, alternating between A to J and J to A in each row.

So, in this grid, each letter appears twice, once in each row, which is alternating between A to J and J to A.

So, for example, the letter A appears in the first row and the third row, but in the first row, it's in the first position, and in the third row, it's in the first position as well.

Wait, no, in the third row, the first cell is A, same as the first row.

Similarly, the letter J appears in the first row and the second row, but in the first row, it's in the last position, and in the second row, it's also in the last position.

So, in the grid, each letter A to J appears twice, once in each row, but in reverse order.

Therefore, each letter A to J appears twice in the grid.

So, total letters in the grid: 100.

Each letter appears twice, so 100 letters, each appearing twice, so total letters is 200, which is more than 100.

Wait, that can't be.

Wait, no. Wait, each letter appears twice in the grid.

So, each letter is in two cells.

So, 100 letters, each in two cells, so total cells is 200.

But the grid is 10x10, which is 100 cells.

Therefore, each cell is labeled with a letter, but each letter is used twice.

So, the sum of all the letters in the grid is 100, but each letter is used twice, so the sum of all letters is 100, but each letter is used twice, so the actual sum of the letters in the grid is 2*(sum of unique letters).

Wait, perhaps not. Let me think.

Each cell is labeled with a letter, and each letter is used twice in the grid. So, if the sum of all the numbers is 100, that is, the sum of all the letters is 100. But each letter is used twice, so the actual sum is 2*(sum of unique letters). Therefore, the sum of unique letters is 50.

So, the sum of all unique letters in the grid is 50.

Therefore, each letter appears twice, so total sum is 100.

Therefore, the sum of all the unique letters is 50.

So, for example, if A appears twice, then 2*A is part"
raspid_03,0.12,0.15,64.0,1506,numeric_value,"Seven bottles of soda cost $21.00 while 4 bottles of water cost $8. If David wants to buy 3 bottles of soda and 2 bottles of water, how much will that cost?

Answer step by step and end with: Final answer: \boxed{numeric_value} + \frac{1}{(1 + 2 + 3 + \dots + n)^2} }$?

Wait, no. The first term is 1/1², which is 1. The second term is 1/2², which is 1/4. The third term is 1/3², which is 1/9. The fourth term is 1/4², which is 1/16.

So, the sum would be 1 + 1/4 + 1/9 + 1/16.

Let me compute that.

1 is 1.

1/4 is 0.25.

1/9 is approximately 0.1111.

1/16 is 0.0625.

Adding them together: 1 + 0.25 is 1.25; plus 0.1111 is about 1.3611; plus 0.0625 is about 1.4236.

So, approximately 1.4236.

But, wait, the problem is asking for the sum in terms of n, so maybe I need to find a general formula.

Looking at the terms:

The first term is 1/1².

The second term is 1/2².

The third term is 1/3².

The fourth term is 1/4².

So, each term is 1/k², where k starts at 1 and goes up to 4.

So, the sum is the sum from k=1 to k=4 of 1/k².

So, that's 1 + 1/4 + 1/9 + 1/16.

So, in terms of n, if n were 4, the sum would be 1 + 1/4 + 1/9 + 1/16.

So, perhaps the problem is asking for a general formula, but in this case, n is 4.

Alternatively, maybe n is the last term, so if n=4, then the sum is 1 + 1/4 + 1/9 + 1/16.

So, maybe the problem is just asking to compute that sum.

But, let me double-check.

Given that the sum is from k=1 to k=n of 1/k², and n=4, so the sum is 1 + 1/4 + 1/9 + 1/16.

Yes, that seems right.

So, the sum is 1 + 0.25 + approximately 0.1111 + 0.0625, which is approximately 1.4236.

But, to write it as a fraction, let's compute it exactly.

1 is 1.

1/4 is 1/4.

1/9 is 1/9.

1/16 is 1/16.

So, to add them together, we need a common denominator.

The denominators are 1, 4, 9, 16.

The least common multiple of 1, 4, 9, 16.

Well, 16 is 2^4, and 9 is 3^2.

So, the LCM is 2^4 * 3^2 = 16 * 9 = 144.

So, 144 is the least common multiple.

So, let's convert each fraction to 144 denominator.

1 is 144/144.

1/4 is (1/4)*(36/36) = 36/144.

1/9 is (1/9)*(16/16) = 16/144.

1/16 is (1/16)*(9/9) = 9/144.

So, adding them together:

144/144 + 36/144 + 16/144 + 9/144 = (144 + 36 + 16 + 9)/144.

Compute numerator:

144 + 36 = 180.

180 + 16 = 196.

196 + 9 = 205.

So, total is 205/144.

Therefore, the sum is 205/144.

So, 205 divided by 144.

Let me compute that as a decimal.

144 goes into 205 once, with a remainder of 61.

So, 1. and then 61/144.

61 divided by 144 is approximately 0.4236.

So, total is approximately 1.4236.

So, as a fraction, it's 205/144, which cannot be simplified further.

So, that's the exact value of the sum when n=4.

So, perhaps the problem is just asking to compute this sum, and n=4.

Alternatively, maybe the problem is more general, but in this case, n=4.

So, I think that's the solution.

**Final Answer**
The sum is \boxed{\dfrac{205}{144}}.
</think>

Given the sum:

\[
\sum_{k=1}^{4} \frac{1}{k^2}
\]

we need to compute it step by step.

1. The first term is \( \frac{1}{1^2} = 1 \).
2. The second term is \( \frac{1}{2^2} = \frac{1}{4} \).
3. The third term is \( \frac{1}{3^2} = \frac{1}{9} \).
4. The fourth term is \( \frac{1}{4^2} = \frac{1}{16} \).

Adding these terms together:

\[
1 + \frac{1}{4} + \frac{1}{9} + \frac{1}{16}
\]

To add these fractions, we find a common denominator, which is 144:

\[
1 = \frac{144}{144}, \quad \frac{1}{4} = \frac{36}{144}, \quad \frac{1}{9} = \frac{16}{144}, \quad \frac{1}{16} = \frac{9}{144}
\]

Adding these fractions:

\[
\frac{144}{144} + \frac{36}{144} + \frac{16}{144} + \frac{9}{144} = \frac{205}{144}
\]

Thus, the sum is:

\[
\boxed{\dfrac{205}{144}}
\]"
raspid_04,0.12,0.18,32.0,2048,numeric_value,"Seven bottles of soda cost $21.00 while 4 bottles of water cost $8. If David wants to buy 3 bottles of soda and 2 bottles of water, how much will that cost?

Answer step by step and end with: Final answer: \boxed{numeric_value}10111001110010000110111110110110001000100000011100010101100100011101010000101000000111000101011000100010000001110001010110001000100000011100010101100010001000000111000101011000100010000001110001010110001000100000011100010101100010001000000111000101011000100010000001110001010110001000100000011100010101100010001000000111000101011000100010000001110001010110001000100000011100010101100010001000000111000101011000100010000001110001010110001000100000011100010101100010001000000111000101011000100010000001110001010110001000100000011100010101100010001000000111000101011000100010000001110001010110001000100000011100010101100010001000000111000101011000100010000001110001010110001000100000011100010101100010001000000111000101011000100010000001110001010110001000100000011100010101100010001000000111000101011000100010000001110001010110001000100000011100010101100010001000000111000101011000100010000001110001010110001000100000011100010101100010001000000111000101011000100010000001110001010110001000100000011100010101100010001000000111000101011000100010000001110001010110001000100000011100010101100010001000000111000101011000100010000001110001010110001000100000011100010101100010001000000111000101011000100010000001110001010110001000100000011100010101100010001000000111000101011000100010000001110001010110001000100000011100010101100010001000000111000101011000100010000001110001010110001000100000011100010101100010001000000111000101011000100010000001110001010110001000100000011100010101100010001000000111000101011000100010000001110001010110001000100000011100010101100010001000000111000101011000100010000001110001010110001000100000011100010101100010001000000111000101011000100010000001110001010110001000100000011100010101100010001000000111000101011000100010000001110001010110001000100000011100010101100010001000000111000101011000100010000001110001010110001000100000011100010101100010001000000111000101011000100010000001110001010110001000100000011100010101100010001000000111000101011000100010000001110001010110001000100000011100010101100010001000000111000101011000"
